{
  "id": "dr-valid-001",
  "user_id": "user-conformance-001",
  "device_id": "device-conformance-001",
  "platform": "android",
  "fcm_token": "APA91bConformanceTestFCMToken==",
  "app_version": "1.0.0",
  "is_active": true,
  "created_at": "2026-01-01T00:00:00Z",
  "updated_at": "2026-01-01T00:00:00Z"
}
